{
  "$schema": "../schema/fixture.schema.json",
  "schemaVersion": "1.0.0",
  "id": "large-read",
  "revision": 1,
  "description": "Large single-request DB read within negotiated PDU (go-s7comm chunks larger spans client-side)",
  "tags": ["db", "pdu", "go-s7comm"],
  "requires": ["area.db", "operation.read"],
  "notes": "Full multi-PDU segmentation is exercised by go-s7comm ReadArea chunking in M7 against this server.",
  "server": { "rack": 0, "slot": 2, "pduSize": 480 },
  "areas": [
    {
      "type": "db",
      "number": 1,
      "size": 256,
      "access": "read-write",
      "initial": {
        "hex": "000102030405060708090a0b0c0d0e0f101112131415161718191a1b1c1d1e1f202122232425262728292a2b2c2d2e2f303132333435363738393a3b3c3d3e3f"
      },
      "values": [
        {
          "offset": 64,
          "dataType": "bytes",
          "length": 64,
          "value": [
            64, 65, 66, 67, 68, 69, 70, 71, 72, 73, 74, 75, 76, 77, 78, 79,
            80, 81, 82, 83, 84, 85, 86, 87, 88, 89, 90, 91, 92, 93, 94, 95,
            96, 97, 98, 99, 100, 101, 102, 103, 104, 105, 106, 107, 108, 109, 110, 111,
            112, 113, 114, 115, 116, 117, 118, 119, 120, 121, 122, 123, 124, 125, 126, 127
          ]
        }
      ]
    }
  ],
  "expectations": [
    {
      "operation": "read",
      "area": { "type": "db", "number": 1 },
      "offset": 0,
      "length": 64,
      "result": {
        "hex": "000102030405060708090a0b0c0d0e0f101112131415161718191a1b1c1d1e1f202122232425262728292a2b2c2d2e2f303132333435363738393a3b3c3d3e3f"
      }
    },
    {
      "operation": "read",
      "area": { "type": "db", "number": 1 },
      "offset": 64,
      "length": 64,
      "result": {
        "hex": "404142434445464748494a4b4c4d4e4f505152535455565758595a5b5c5d5e5f606162636465666768696a6b6c6d6e6f707172737475767778797a7b7c7d7e7f"
      }
    }
  ]
}
